{
  "$schema": "https://json-schema.org/draft/2020-12/schema",
  "$id": "schema://frank.event/v1",
  "title": "FRANK event envelope",
  "description": "FRANK-§6.7. CloudEvents-compatible envelope with explicit schema version, cell scope, correlation, causation, classification, and idempotency. A transaction writes domain state and the outbox event together (ADR-004).",
  "type": "object",
  "additionalProperties": false,
  "required": [
    "specversion",
    "type",
    "source",
    "id",
    "time",
    "dataschema",
    "datacontenttype",
    "cellid",
    "actorid",
    "correlationid",
    "classification",
    "data"
  ],
  "properties": {
    "specversion": { "const": "1.0" },
    "type": {
      "description": "Versioned event type. The trailing .vN is required so consumers pin a schema (ADR-017).",
      "type": "string",
      "pattern": "^frank\\.[a-z0-9]+(\\.[a-z0-9-]+)*\\.v[0-9]+$"
    },
    "source": {
      "type": "string",
      "pattern": "^frank://[a-z0-9-]+(/[A-Za-z0-9._-]+)*$"
    },
    "id": { "type": "string", "minLength": 1 },
    "time": { "type": "string", "format": "date-time" },
    "subject": { "type": "string" },
    "dataschema": {
      "type": "string",
      "pattern": "^schema://[A-Za-z0-9._-]+/v[0-9]+$"
    },
    "datacontenttype": { "const": "application/json" },
    "cellid": {
      "description": "FRANK-§2.4. Every event is scoped to exactly one cell. Cross-cell delivery is not representable.",
      "type": "string",
      "minLength": 1
    },
    "actorid": { "type": "string", "minLength": 1 },
    "correlationid": { "type": "string", "minLength": 1 },
    "causationid": { "type": "string" },
    "classification": { "$ref": "schema://frank.classification/v1#/$defs/DataClass" },
    "idempotencykey": {
      "description": "Required for events that drive an external side effect (FRANK-§13.5).",
      "type": "string"
    },
    "data": { "type": "object" }
  }
}
