{
  "specversion": "1.0",
  "type": "frank.work.item-created.v1",
  "source": "frank://work/WorkItemService",
  "id": "01J8Z4Q7M2K5R9T3V6X0B4N7C2",
  "time": "2026-07-28T09:14:03.221Z",
  "subject": "work-item/wi-8842",
  "dataschema": "schema://frank.work-item/v1",
  "datacontenttype": "application/json",
  "cellid": "cell-steven-primary",
  "actorid": "principal:steven",
  "correlationid": "corr-2026-07-28-0001",
  "causationid": "cmd-capture-8841",
  "classification": "private",
  "idempotencykey": "work-item-created:wi-8842",
  "data": {
    "workItemId": "wi-8842",
    "title": "Reply to landlord about the roof inspection",
    "status": "waiting",
    "ownerId": "principal:steven"
  }
}
